{
  "schemaVersion": "1.0.0",
  "bankId": "six-sigma-public-sample",
  "title": {
    "en": "Six Sigma Public Sample Questions",
    "zh": "六西格玛公开样例题"
  },
  "sourceType": "public-sample",
  "questions": [
    {
      "questionId": "sample-dmaic-001",
      "examId": "public-sample",
      "sourceType": "public-sample",
      "domain": "Define",
      "chapterId": "ch02",
      "page": 22,
      "difficulty": "easy",
      "questionType": "single",
      "stem": {
        "en": "Which DMAIC phase normally defines the problem statement and project scope?",
        "zh": "DMAIC 中通常由哪个阶段定义问题陈述和项目范围？"
      },
      "options": [
        { "id": "A", "en": "Define", "zh": "定义" },
        { "id": "B", "en": "Measure", "zh": "测量" },
        { "id": "C", "en": "Analyze", "zh": "分析" },
        { "id": "D", "en": "Control", "zh": "控制" }
      ],
      "correctAnswer": ["A"],
      "explanation": {
        "en": "Define frames the business problem, customer need, goal, scope, and team charter before measurement work begins.",
        "zh": "定义阶段先界定业务问题、客户需求、目标、范围和团队章程，然后才进入测量工作。"
      },
      "tags": ["DMAIC", "project charter"],
      "sourceRef": "Original public sample based on common Six Sigma curriculum terms.",
      "reviewStats": {
        "seenCount": 0,
        "correctCount": 0,
        "wrongCount": 0,
        "unknownCount": 0
      }
    },
    {
      "questionId": "sample-lean-006",
      "examId": "public-sample",
      "sourceType": "public-sample",
      "domain": "Improve",
      "chapterId": "ch30",
      "page": 394,
      "difficulty": "easy",
      "questionType": "multiple",
      "stem": {
        "en": "Which items are commonly treated as lean waste categories?",
        "zh": "以下哪些通常属于精益浪费类别？"
      },
      "options": [
        { "id": "A", "en": "Waiting", "zh": "等待" },
        { "id": "B", "en": "Overproduction", "zh": "过量生产" },
        { "id": "C", "en": "Customer satisfaction", "zh": "客户满意" },
        { "id": "D", "en": "Rework", "zh": "返工" }
      ],
      "correctAnswer": ["A", "B", "D"],
      "explanation": {
        "en": "Waiting, overproduction, and defects/rework are common lean waste categories.",
        "zh": "等待、过量生产和缺陷/返工都是常见精益浪费类别。"
      },
      "tags": ["lean", "waste"],
      "sourceRef": "Original public sample.",
      "reviewStats": {
        "seenCount": 0,
        "correctCount": 0,
        "wrongCount": 0,
        "unknownCount": 0
      }
    }
  ]
}
